,organization,date_posted,days_from_mr_Floyd,title_text,body_text,goal_present,goal_text,action_future,action_past,action_future_concrete,action_future_measure,action_past_concrete,action_past_measure,action_text,date_action_item_accomplished,date_text,measure_present,measure_text,education_count,assess_competence,group_links_competence,group_links_social_justice,link_community,links_other,link_other_description,cleaned_sentences,raw_neg,raw_neu,raw_pos,raw_compound,cleaned_neg,cleaned_neu,cleaned_pos,cleaned_compound,raw_neg,raw_neu,raw_pos,raw_compound,cleaned_neg,cleaned_neu,cleaned_pos,cleaned_compound
7,Association of Behavior and Cognitive Therapies Statement,6/4/2020 (found on facebook),9.0,ABCT Statement on Racism and Discrimination,"The Association for Behavioral and Cognitive Therapies is outraged by the murder of George Floyd, Breonna Taylor, and countless others at the hands of police officers and broader law enforcement, healthcare, and many other societal systems that devalue Black lives. ABCT's mission states that we are ""committed to the enhancement of health and well-being,"" and our goal is to help those in need to heal. So, when we see a system designed to protect us, instead be one that kills, hurts, and disenfranchises communities of color, we are all the more enraged, troubled, and hurt. 
And we are called to self-reflect, and to act. 
As members of the Association for Behavioral and Cognitive Therapies, we use science to enhance health and well-being. The health and well-being of our Black colleagues, students, patients, friends, and family are repeatedly threatened and damaged by the systemic racism in our society. We publicly voice our support for social justice organizations, like Black Lives Matter and NAACP, who are on the frontlines, mobilizing for real lasting change in Black and Brown communities. We call on our members to use our science to help end racial injustice and police brutality, especially our members who typically shy away from this work. As therapists and researchers, we have tools and expertise that can help us work toward justice. As therapists, for example, we must create space for our patients to discuss racial discrimination if they choose, listening openly and checking our biases; as researchers, for example, we must work harder in authentic methodological design and recruitment to ensure sample diversity and inclusivity, and to improve our ability to assess racial differences. 
As therapists and researchers, we must also acknowledge our privilege and role within the broader system of generating and disseminating knowledge. We must commit to reflecting and exploring what opportunities we have had (and maybe looked past), and to use our privilege to address injustices and reflect on how we can actively seek opportunities. We believe the tools and expertise we possess grant us a privilege that must be acknowledged and acted upon. 
In 2019, ABCT launched a Task Force to Promote Equity, Inclusion, and Access. The Task Force surveyed members in March and April of this year, to assess members' opinions on how ABCT is doing with respect to equity, inclusion, and access. A detailed summary based on close to 400 responses was recently shared with the ABCT Board of Directors. Next, the Task Force will draft a full report, including recommendations for how ABCT can better support diversity and inclusion across everything that we do, especially supporting our members and stakeholders from the Black community. We also look forward to learning what resources (e.g., readings, educational opportunities, expert conversations) our members might find helpful for addressing racism and discrimination in their work, and to making these resources available. ABCT is committed to improving and growing, with respect to equity, diversity, and inclusion. 
To our Black members: We see you. We hear you. We are committed to listening to you and standing with you. ",1.0,"We call on our members to use our science to help end racial injustice and police brutality, especially our members who typically shy away from this work. As therapists and researchers, we have tools and expertise that can help us work toward justice. As therapists, for example, we must create space for our patients to discuss racial discrimination if they choose, listening openly and checking our biases; as researchers, for example, we must work harder in authentic methodological design and recruitment to ensure sample diversity and inclusivity, and to improve our ability to assess racial differences.",1.0,1.0,1.0,1.0,1.0,1.0,"In 2019, ABCT launched a Task Force to Promote Equity, Inclusion, and Access. The Task Force surveyed members in March and April of this year, to assess members' opinions on how ABCT is doing with respect to equity, inclusion, and access. A detailed summary based on close to 400 responses was recently shared with the ABCT Board of Directors...   Next, the Task Force will draft a full report, including recommendations for how ABCT can better support diversity and inclusion across everything that we do, especially supporting our members and stakeholders from the Black community.",0.0,,1.0,"As therapists and researchers, we have tools and expertise that can help us work toward justice. As therapists, for example, we must create space for our patients to discuss racial discrimination if they choose, listening openly and checking our biases; as researchers, for example, we must work harder in authentic methodological design and recruitment to ensure sample diversity and inclusivity, and to improve our ability to assess racial differences.",0.0,0.0,0.0,0.0,0.0,0.0,,association behavioral cognitive therapies outrage murder george floyd breonna taylor countless others hand police officer broader law enforcement healthcare many societal systems devalue black live abct mission state commit enhancement health well-being goal help need heal see system design protect us instead one kill hurt disenfranchise communities color enrage trouble hurt call self-reflect act members association behavioral cognitive therapies use science enhance health well-being health well-being black colleagues students patients friends family repeatedly threaten damage systemic racism society publicly voice support social justice organizations like black live matter naacp frontlines mobilize real last change black brown communities call members use science help end racial injustice police brutality especially members typically shy away work therapists researchers tool expertise help us work toward justice therapists example must create space patients discuss racial discrimination choose listen openly check bias researchers example must work harder authentic methodological design recruitment ensure sample diversity inclusivity improve ability assess racial differences therapists researchers must also acknowledge privilege role within broader system generate disseminate knowledge must commit reflect explore opportunities maybe look past use privilege address injustices reflect actively seek opportunities believe tool expertise possess grant us privilege must acknowledge act upon 2019 abct launch task force promote equity inclusion access task force survey members march april year assess members opinions abct respect equity inclusion access detail summary base close 400 responses recently share abct board directors next task force draft full report include recommendations abct better support diversity inclusion across everything especially support members stakeholders black community also look forward learn resources e.g. read educational opportunities expert conversations members might find helpful address racism discrimination work make resources available abct commit improve grow respect equity diversity inclusion black members see hear commit listen stand,0.081,0.76,0.158,0.986,0.134,0.619,0.246,0.9845,0.081,0.76,0.158,0.986,0.134,0.619,0.246,0.9845
8,National Committee on Racial and Ethnic Diversity (NCORED)/ National Association of Social Workers (NASW),6/10/2020,18.0,Anti-Racism Now and Forever More,"We condemn racism. We condemn white supremacy. We condemn the devaluation of Black lives and Black humanity that pervades our society.
The killings of George Floyd, Breonna Taylor, Ahmaud Arbery and countless others are rooted in these social ills and reflect profound failings on the part of institutions that are supposed to protect and keep us all safe. These tragedies are linked to a legacy of racialized violence in the United States that continues to plague Black people and Black communities.
As social workers committed to social justice and the dignity and worth of all of humanity, we recognize the pain, suffering, and outrage resulting from a long history of racism, oppression, and discrimination in this country. Social workers and other professionals across the nation are needed to address the inadequacies of our social systems in combating racism.
Injustice is never acceptable and we are called to fight it, especially within our own areas. The diversity in our nation and world delivers substantial opportunities for perspective sharing through cultural acknowledgement and acceptance.
In so stating, cultural competence takes into account the fluidity of our social system while it embraces cultural differences through all social interactions. Currently the insurmountable periods of distress calls for unity across the professional scope. Too often political systems, rules, and policies omit or disregard the necessity to embrace diversity and inclusivity. Cultural competence has paved the way to increased awareness, sensitivity, knowledge, and improved skill-based practice.
The time for advocacy to address the outrage and immeasurable dissociations is now. Social workers must strengthen our commitment to equity by reaffirming our fight to eradicate racism and all forms of injustices.
NCORED reaffirms our commitment to promote conditions, which encourage respect for the diversity of cultures including equality of opportunity in all activities of the association, with a particular focus on those groups that have historically been subject to racism. In this commitment, we acknowledge both the pain of racism and the work necessary to eradicate it.
NCORED is committed to advocating for reforms to address the conscious and unconscious bias in housing, employment, education, social welfare, child welfare, healthcare, mental health, and other systems in which we have influence as social workers.
We also want to recognize that people of color in our own midst — in our membership organization (NASW) — are injured and reinjured by the death of George Floyd, because it symbolizes the racism that so many of us have endured ourselves and/or vicariously with [and for] our loved ones.
As a Committee, we want to support each other, especially Black and Brown communities. We will continue our efforts to ensure respect, inclusion, fairness and equity in our social work practices and social justice actions for and with the individuals, communities and families that NASW members serve. We are committed to creating and sustaining healthy environments where Black Lives Matter and are valued and supported in all that we do as social workers.
Real change requires action. In the words of political activist, author, philosopher and educator Angela Y. Davis, “In a racist society, it is not enough to be non-racist, we must be anti-racist.”
As social workers, our professional ethical mandate includes being actively opposed to racism in all its forms — individual, interpersonal, institutional, and structural. Using the Standards and Indicators for Cultural Competence in Social Work Practice developed by NCORED as a framework, we propose the following resources for promoting anti-racism:
Being Anti-Racist (National Museum of African American History and Culture)
Reading List (Center for Racial Justice in Education)
An Anti-Racist Reading List (Ibram X. Kendi, PhD)
Personal Self-Assessment of Anti-Bias Behavior (Anti-Defamation League)
Institutional Racism and the Social Work Profession: A Call to Action (NASW)
In Solidarity,
The Members of NCORED",1.0,"The time for advocacy to address the outrage and immeasurable dissociations is now. Social workers must strengthen our commitment to equity by reaffirming our fight to eradicate racism and all forms of injustices.
NCORED reaffirms our commitment to promote conditions, which encourage respect for the diversity of cultures including equality of opportunity in all activities of the association, with a particular focus on those groups that have historically been subject to racism. In this commitment, we acknowledge both the pain of racism and the work necessary to eradicate it.
NCORED is committed to advocating for reforms to address the conscious and unconscious bias in housing, employment, education, social welfare, child welfare, healthcare, mental health, and other systems in which we have influence as social workers.",0.0,0.0,0.0,0.0,0.0,0.0,,0.0,,0.0,,0.0,0.0,1.0,4.0,0.0,0.0,,condemn racism condemn white supremacy condemn devaluation black live black humanity pervade society kill george floyd breonna taylor ahmaud arbery countless others root social ills reflect profound fail part institutions suppose protect keep us safe tragedies link legacy racialized violence unite state continue plague black people black communities social workers commit social justice dignity worth humanity recognize pain suffer outrage result long history racism oppression discrimination country social workers professionals across nation need address inadequacies social systems combat racism injustice never acceptable call fight especially within areas diversity nation world deliver substantial opportunities perspective share cultural acknowledgement acceptance state cultural competence take account fluidity social system embrace cultural differences social interactions currently insurmountable periods distress call unity across professional scope often political systems rule policies omit disregard necessity embrace diversity inclusivity cultural competence pave way increase awareness sensitivity knowledge improve skill-based practice time advocacy address outrage immeasurable dissociations social workers must strengthen commitment equity reaffirm fight eradicate racism form injustices ncored reaffirm commitment promote condition encourage respect diversity culture include equality opportunity activities association particular focus group historically subject racism commitment acknowledge pain racism work necessary eradicate ncored commit advocate reform address conscious unconscious bias house employment education social welfare child welfare healthcare mental health systems influence social workers also want recognize people color midst — membership organization nasw — injure reinjured death george floyd symbolize racism many us endure andor vicariously love ones committee want support especially black brown communities continue efforts ensure respect inclusion fairness equity social work practice social justice action individuals communities families nasw members serve commit create sustain healthy environments black live matter value support social workers real change require action word political activist author philosopher educator angela y. davis “ racist society enough non-racist must anti-racist. ” social workers professional ethical mandate include actively oppose racism form — individual interpersonal institutional structural use standards indicators cultural competence social work practice develop ncored framework propose follow resources promote anti-racism anti-racist national museum african american history culture read list center racial justice education anti-racist read list ibram x. kendi phd personal self-assessment anti-bias behavior anti-defamation league institutional racism social work profession call action nasw solidarity members ncored,0.142,0.716,0.142,-0.9344,0.207,0.57,0.223,-0.8314,0.142,0.716,0.142,-0.9344,0.207,0.57,0.223,-0.8314
9,standard celeration society,6/3/20,8.0,enough is enough,"The board of the Standard Celeration Society (SCS) vehemently refuses to be silent about the events occurring around the nation that have occurred since the founding of this country. With this statement we unequivocally affirm that Black Lives Matter.
As an organization, the SCS commits to standard celeration charting in service of racial justice. This means noting racial inequity, especially as it pertains to police brutality, to apply behavior analysis and science in the efforts to reduce harm, increase well-being, and create transformative justice within our communities and in the world. We are committed to creating equitable, safe and caring learning environments for all segments of society. We call upon the SCS membership and other professional organizations within behavior analysis to join us in committed action. We will pursue this with authenticity, kindness, openness, shared vision and, above all, seek meaningful change. We take a stand against systemic and societal racism.
To best serve as accomplices to all underrepresented and marginalized groups, we promise to continuously listen and educate ourselves in matters related to social justice and equity. To current and future members, if this statement is not in alignment with your values, we implore you to seek further education or discontinue your membership in the SCS.
In Solidarity,
The Board of the Standard Celeration Society
Kerri Milyko, Ph.D., BCBA-D, LBA – Chairwoman
Kendra Newsome, Ph.D., BCBA-D, LBA – Secretary
Andrew Bulla, Ph.D., BCBA
Liz Lefebre, MS, BCBA, LBA
Clay Starlin, Ph.D.",1.0,"""…the SCS commits to standard celeration charting in service of racial justice""; ""We are committed to creating equitable, safe and caring learning environments for all segments of society.""",1.0,0.0,0.0,0.0,,,"""This means noting racial inequity, especially as it pertains to police brutality, to apply behavior analysis and science in the efforts to reduce harm, increase well-being, and create transformative justice within our communities and in the world.""; ""To best serve as accomplices to all underrepresented and marginalized groups, we promise to contiuously listen and educate ourselves in matters related to social justice and equity.""",0.0,,0.0,,0.0,0.0,0.0,0.0,0.0,0.0,,board standard celeration society scs vehemently refuse silent events occur around nation occur since found country statement unequivocally affirm black live matter organization scs commit standard celeration chart service racial justice mean note racial inequity especially pertain police brutality apply behavior analysis science efforts reduce harm increase well-being create transformative justice within communities world commit create equitable safe care learn environments segment society call upon scs membership professional organizations within behavior analysis join us commit action pursue authenticity kindness openness share vision seek meaningful change take stand systemic societal racism best serve accomplices underrepresented marginalize group promise continuously listen educate matter relate social justice equity current future members statement alignment value implore seek education discontinue membership scs solidarity board standard celeration society kerri milyko ph.d. bcba-d lba – chairwoman kendra newsome ph.d. bcba-d lba – secretary andrew bulla ph.d. bcba liz lefebre ms bcba lba clay starlin ph.d,0.041,0.759,0.2,0.9877,0.074,0.627,0.299,0.9869,0.041,0.759,0.2,0.9877,0.074,0.627,0.299,0.9869
