,organization,date_posted,days_from_mr_Floyd,title_text,body_text,goal_present,goal_text,action_future,action_past,action_future_concrete,action_future_measure,action_past_concrete,action_past_measure,action_text,date_action_item_accomplished,date_text,measure_present,measure_text,education_count,assess_competence,group_links_competence,group_links_social_justice,link_community,links_other,link_other_description,cleaned_sentences,raw_neg,raw_neu,raw_pos,raw_compound,cleaned_neg,cleaned_neu,cleaned_pos,cleaned_compound,raw_neg,raw_neu,raw_pos,raw_compound,cleaned_neg,cleaned_neu,cleaned_pos,cleaned_compound
4,Florida Associaton for Behavior Analysis,6/1/2020; 6/3/2020,6.0,"Change Behaviors, Change Racism; The Fight Agaisnt Systemic Racism","In these difficult times, our board believes that we must not stay silent. We are deeply saddened and angered by recent and ongoing events targeting the black community. Therefore, we want to be clear that FABA condemns acts of racism, hate, injustice, and brutality. Today, we stand with our black members, clients, and community in the fight against systemic racism and racial violence.
We think it is important to acknowledge that behavior analysis has not given these issues enough attention and that we have a lot of work to do. Behavior analysts can contribute to the conversation and efforts to create a more equitable and just world.
For now, we would like to share this recent publication: https://link.springer.com/article/10.1007/s40617-020-00411-4; Recently, there have been many demonstrations occurring across the U.S. to bring attention to the tragic killings of Black lives. We are deeply saddened and angry by these events and our board believes that we must not stay silent during times of injustice. Therefore, we want to be clear that FABA condemns acts of racism, hate, injustice, and brutality faced by the Black community. Today, we stand with our Black members, clients, and community in the fight against systemic racism and racial violence. We hear you and value your voice and lives.
We think it is important to acknowledge that behavior analysis has not given these issues enough attention and that we have a lot of work to do. Behavior analysts have tools to contribute to the conversation and efforts to create a more equitable and just world.
We will be self- assessing and evaluating how FABA can contribute to issues related to diversity and social justice issues at our upcoming conference. Additionally, we encourage submissions on diversity and social justice to be submitted so that we have these conversations and highlight what researchers in our field can do to promote justice.
For now, we would like to share this recent publication: https://link.springer.com/article/10.1007/s40617-020-00411-4",1.0,We will be self- assessing and evaluating how FABA can contribute to issues related to diversity and social justice issues at our upcoming conference.,1.0,0.0,1.0,1.0,0.0,0.0,we encourage submissions on diversity and social justice to be submitted so that we have these conversations and highlight what researchers in our field can do to promote justice,0.0,,0.0,,0.0,0.0,0.0,1.0,0.0,0.0,,difficult time board believe must stay silent deeply sadden anger recent ongoing events target black community therefore want clear faba condemn act racism hate injustice brutality today stand black members clients community fight systemic racism racial violence think important acknowledge behavior analysis give issue enough attention lot work behavior analysts contribute conversation efforts create equitable world would like share recent publication https link.springer.comarticle10.1007s40617-020-00411-4 recently many demonstrations occur across u.s. bring attention tragic kill black live deeply sadden angry events board believe must stay silent time injustice therefore want clear faba condemn act racism hate injustice brutality face black community today stand black members clients community fight systemic racism racial violence hear value voice live think important acknowledge behavior analysis give issue enough attention lot work behavior analysts tool contribute conversation efforts create equitable world self- assess evaluate faba contribute issue relate diversity social justice issue upcoming conference additionally encourage submissions diversity social justice submit conversations highlight researchers field promote justice would like share recent publication https link.springer.comarticle10.1007s40617-020-00411-4,0.215,0.673,0.113,-0.9944,0.339,0.483,0.179,-0.9943,0.215,0.673,0.113,-0.9944,0.339,0.483,0.179,-0.9943
5,Society for Prevention Research,6/5/20,10.0,SPR AND NPSC STATEMENT CONDEMNING RACISM,"The following message is being sent from SPR President, Guillermo Prado, on behalf of the SPR Board of Directors, and NPSC Co-Directors, Diana Fishbein and John Roman, on behalf of the NPSC Board of Directors.
Dear Friends, Collaborators, and Partners,
George Floyd’s death adds to a rapidly growing list of Black people assaulted and killed in the U.S. as a direct consequence of our society’s structural, systemic, and individual racism. Racial profiling and aggressive, discriminatory policing ranging from threats to lethal force are commonplace experiences for many Black Americans. The problems within policing are neither unique nor isolated: racism is in the groundwater of our country.
Racism impacts the health, mental health, and wellbeing of children born Black in America in ways that are evident throughout the life course. Black Americans are more often exposed to and at increased risk of death from the COVID-19 virus due to disproportionate exposure through employment in “essential” industries, healthcare access disparities, provider bias, and other structural disparities. These disparities impact economic stability, employment, food security, educational opportunities, housing and a host of other important contributors to health and wellbeing.
The Society for Prevention Research (SPR) and the National Prevention Science Coalition to Improve Lives (NPSC) recognize institutional, systemic and individual racism as a fundamental cause of disparities across all of society, directly affecting health, housing, education, employment, and equitable treatment of Black Americans. Racism, coupled with our ongoing tolerance for it, undermines democratic values for all people in the U.S.
As prevention researchers, educators and practitioners, we condemn the atrocities and pain that has been inflicted on Black people for centuries. We must call attention to the deep and indelible impacts of racism on Black Americans and other people of color while calling for change. This will require a coordinated public health effort as racism is a chronic and insidious illness that hurts all Americans.
We support the widescale implementation of programs and policies generated by the field of prevention science shown to ameliorate, challenge, and change system, institutional and individual level policies and practices that perpetuate and sustain racism. We are collectively committed to working with governing bodies and communities to promote the use of evidence-based, prevention science-based solutions that are community-led to ensure that all Black Americans and people of color live in a society that is fair, just and equitable. Prevention science investments in effective programs, policies and practices, and in training the next generation of prevention scientists and practitioners, will assure that we can all work together as a nation to eradicate racism.
With sincere commitment,
Guillermo Prado, SPR President
Diana Fishbein, NPSC, Co-Director
John Roman, NPSC, Co-Director",1.0,"We are collectively committed to working with governing bodies and communities to promote the use of evidence-based, prevention science-based solutions that are community-led to ensure that all Black Americans and people of color live in a society that is fair, just and equitable",0.0,0.0,0.0,0.0,0.0,0.0,,0.0,,0.0,,0.0,0.0,0.0,0.0,0.0,0.0,,follow message send spr president guillermo prado behalf spr board directors npsc co-directors diana fishbein john roman behalf npsc board directors dear friends collaborators partner george floyd ’ death add rapidly grow list black people assault kill u.s. direct consequence society ’ structural systemic individual racism racial profile aggressive discriminatory police range threats lethal force commonplace experience many black americans problems within police neither unique isolate racism groundwater country racism impact health mental health wellbeing children bear black america ways evident throughout life course black americans often expose increase risk death covid-19 virus due disproportionate exposure employment “ essential ” industries healthcare access disparities provider bias structural disparities disparities impact economic stability employment food security educational opportunities house host important contributors health wellbeing society prevention research spr national prevention science coalition improve live npsc recognize institutional systemic individual racism fundamental cause disparities across society directly affect health house education employment equitable treatment black americans racism couple ongoing tolerance undermine democratic value people u.s. prevention researchers educators practitioners condemn atrocities pain inflict black people centuries must call attention deep indelible impact racism black americans people color call change require coordinate public health effort racism chronic insidious illness hurt americans support widescale implementation program policies generate field prevention science show ameliorate challenge change system institutional individual level policies practice perpetuate sustain racism collectively commit work govern body communities promote use evidence-based prevention science-based solutions community-led ensure black americans people color live society fair equitable prevention science investments effective program policies practice train next generation prevention scientists practitioners assure work together nation eradicate racism sincere commitment guillermo prado spr president diana fishbein npsc co-director john roman npsc co-director,0.156,0.746,0.097,-0.9894,0.224,0.635,0.141,-0.9895,0.156,0.746,0.097,-0.9894,0.224,0.635,0.141,-0.9895
6,Association for Contextual Behavior Science,6/2/20,7.0,ACBS Statement on Racism and Violence,"“It is your duty to fortify your own house, so that you may be a house of refuge in times of organization. And now is the time to plot, plan, strategize, organize, and mobilize.” -Rapper Killer Mike, speech to Atlanta Mayoral Press Conference
ACBS is an international organization with the explicit mission of alleviating human suffering, so that we can contribute to the evolution of a more nurturing world. We are living in a time of profound global inequality. Many are struggling to survive while wealth accumulates in the hands of the few. Individuals belonging to minority groups are more likely to bear the burden of this inequality and suffer the most egregious losses. It is well-documented that for individuals who are racial ethnic minorities, indigenous people, members of the LGBTQ community, and women from around the world, the experience of racism and discrimination is associated with poor health and mental health outcomes.
We, the Board of ACBS, are writing this statement to unequivocally oppose structural, cultural, and individual racism, racially motivated violence, hate speech and all forms of prejudice and oppression in evidence throughout the world. We invite our community of researchers, therapists, and helpers to look hard at the many ways in which racism manifests in the world at large. We ask that our scientific community bring to bear the significant strength of contextual behavioral science in shining a light and exploring solutions to discrimination and disparities. We encourage you to bring your compassion, your openness to discourse, and your willingness to stand for communities and people who are discriminated against all over the world.
It has been said that to be silent is to be complicit. We intend to use our voice to join others in creating change. With this in mind, we make the following statement on the events in the USA.
ACBS Board Statement regarding the problems in the USA
Although our members come from all over the world, we as the ACBS Board feel we cannot be silent and must speak about recent events in the United States, in particular. This past week, George Floyd was brutally killed, in the light of day, while distraught onlookers watched, by police officers sworn to protect, and who instead ignored his cries for mercy. This incident is emblematic of the unconscionable, cruel, and unjust losses the Black community has suffered in the U.S. due to individual, systemic, and structurally embedded racism.
Mr. Floyd is one of many Black people who have been killed in the U.S. as a result of racism and discrimination. Breonna Taylor, Ahmaud Arbery, Trayvon Martin, Atatiana Jefferson, Stephon Clark, Jordan Edwards, Alton Sterling, Tamir Rice, Eric Garner, Sandra Bland - the list of those killed without cause goes on and on, and is staggering in its implications. If you are Black and living in the U.S.A., you face a frighteningly high risk of being targeted and killed because of your race. If you are Black and living in the U.S.A. it may not be safe to go jogging, to go birding, to go to a coffee shop, to get pulled over, to stay home, or to demonstrate against racial inequity.
The people of the USA are living in what has aptly been called a “racism pandemic.” This pandemic has serious implications for the health of Black people and by extension, all of us. In addition to myriad negative economic consequences, racism is associated with poor outcomes in both physical health and psychological well-being. Parents raising Black children must send them into a world that is unsafe, unfair, and unjust. During the COVID-19 pandemic, data have revealed that Black and Hispanic communities have suffered greater losses during the than other groups due to underlying healthcare and socioeconomic disparities.
In recent days, we have seen international protests against the death of George Floyd and other victims of police brutality and racist violence. These protests have too often been met with displays of police aggression. Peaceful protesters have been physically assaulted with batons, pepper spray, and rubber bullets.
We, the Board of ACBS stand in solidarity with the Black community and all people of color, indigenous peoples, immigrants, the LGBTQ community, women, and individuals with minority status against all forms of individual, cultural, and systemic racism and discrimination. We add the voices of our organization to those who are calling for an end to racism, racial violence and police brutality in the United States and around the world. We acknowledge with heavy hearts the pain that the families and the communities of these victims are experiencing. We recognize the importance of reflecting on and ameliorating our own role in relation to perpetuating these issues, whether by action or inaction, and the importance of educating ourselves and others to address racism and inequality directly.
We know that this statement is not enough on its own and that this problem will continue if not addressed. We hope that our organization will be part of a collective voice that engages in sustained action demanding safety, justice, and peace for all.",1.0,"We invite our community of researchers, therapists, and helpers to look hard at the many ways in which racism manifests in the world at large. We ask that our scientific community bring to bear the significant strength of contextual behavioral science in shining a light and exploring solutions to discrimination and disparities. We encourage you to bring your compassion, your openness to discourse, and your willingness to stand for communities and people who are discriminated against all over the world.",0.0,0.0,0.0,0.0,0.0,0.0,,0.0,,0.0,,0.0,0.0,0.0,0.0,0.0,0.0,,“ duty fortify house may house refuge time organization time plot plan strategize organize mobilize. ” -rapper killer mike speech atlanta mayoral press conference acbs international organization explicit mission alleviate human suffer contribute evolution nurture world live time profound global inequality many struggle survive wealth accumulate hand individuals belong minority group likely bear burden inequality suffer egregious losses well-documented individuals racial ethnic minorities indigenous people members lgbtq community women around world experience racism discrimination associate poor health mental health outcomes board acbs write statement unequivocally oppose structural cultural individual racism racially motivate violence hate speech form prejudice oppression evidence throughout world invite community researchers therapists helpers look hard many ways racism manifest world large ask scientific community bring bear significant strength contextual behavioral science shin light explore solutions discrimination disparities encourage bring compassion openness discourse willingness stand communities people discriminate world say silent complicit intend use voice join others create change mind make follow statement events usa acbs board statement regard problems usa although members come world acbs board feel silent must speak recent events unite state particular past week george floyd brutally kill light day distraught onlookers watch police officer swear protect instead ignore cry mercy incident emblematic unconscionable cruel unjust losses black community suffer u.s. due individual systemic structurally embed racism mr. floyd one many black people kill u.s. result racism discrimination breonna taylor ahmaud arbery trayvon martin atatiana jefferson stephon clark jordan edwards alton sterling tamir rice eric garner sandra bland list kill without cause go stagger implications black live u.s.a. face frighteningly high risk target kill race black live u.s.a. may safe go jog go bird go coffee shop get pull stay home demonstrate racial inequity people usa live aptly call “ racism pandemic. ” pandemic serious implications health black people extension us addition myriad negative economic consequences racism associate poor outcomes physical health psychological well-being parent raise black children must send world unsafe unfair unjust covid-19 pandemic data reveal black hispanic communities suffer greater losses group due underlie healthcare socioeconomic disparities recent days see international protest death george floyd victims police brutality racist violence protest often meet display police aggression peaceful protesters physically assault batons pepper spray rubber bullets board acbs stand solidarity black community people color indigenous people immigrants lgbtq community women individuals minority status form individual cultural systemic racism discrimination add voice organization call end racism racial violence police brutality unite state around world acknowledge heavy hearts pain families communities victims experience recognize importance reflect ameliorate role relation perpetuate issue whether action inaction importance educate others address racism inequality directly know statement enough problem continue address hope organization part collective voice engage sustain action demand safety justice peace,0.197,0.733,0.07,-0.9992,0.321,0.562,0.116,-0.9992,0.197,0.733,0.07,-0.9992,0.321,0.562,0.116,-0.9992
